Outputs.StackName.Description,The deployment stack name.
Parameters.ProjectResourceHandler.Description,Service token of the custom resource handler.
Parameters.DeploymentName.Description,The name of the deployment associated with this stack.
Parameters.ConfigurationKey.Description,Location in the configuration bucket of configuration data.
Parameters.ProjectStackId.Description,The ARN of the project stack associated with this deployment.
Outputs.StackName.Value,{u'Ref': u'AWS::StackName'}
Resources.Custom::EmptyDeployment.Properties.ServiceToken,{u'Ref': u'ProjectResourceHandler'}
Metadata.CloudCanvas.Id,$Revision: #1 $
Parameters.ConfigurationBucket.Description,Bucket that contains configuration data.
